{
  "id": "relacion.rol.quality_validation.aplica.regla.verify_expected_head_before_merge.v1",
  "entity_family": "relacion",
  "contract_kind": "relationship",
  "version": {
    "major": 1
  },
  "status": "draft",
  "schema_ref": null,
  "descripcion": null,
  "source_refs": [],
  "payload": {
    "origen_entidad": "rol",
    "origen_id": "rol.quality_validation.v1",
    "destino_entidad": "regla",
    "destino_id": "regla.verify_expected_head_before_merge.v1",
    "tipo_relacion": "aplica",
    "cardinalidad": "N:M",
    "requerido": true,
    "orden": null
  }
}
