{
  "id": "relacion.fuente.archive_historical_reference.provee.evidencia.repository_file_reference.v1",
  "entity_family": "relacion",
  "contract_kind": "relationship",
  "version": {
    "major": 1
  },
  "status": "draft",
  "schema_ref": null,
  "descripcion": "Reference-only link from archive historical reference source category to repository file evidence references.",
  "source_refs": [],
  "payload": {
    "origen_entidad": "fuente",
    "origen_id": "fuente.archive_historical_reference.v1",
    "destino_entidad": "evidencia",
    "destino_id": "evidencia.repository_file_reference.v1",
    "tipo_relacion": "provee",
    "cardinalidad": "N:M",
    "requerido": false,
    "orden": null
  }
}
