{
  "id": "relacion.rol.implementation_engineering.aplica.regla.report_evidence_and_boundaries.v1",
  "entity_family": "relacion",
  "contract_kind": "relationship",
  "version": {
    "major": 1
  },
  "status": "active",
  "schema_ref": null,
  "descripcion": null,
  "source_refs": [],
  "payload": {
    "origen_entidad": "rol",
    "origen_id": "rol.implementation_engineering.v1",
    "destino_entidad": "regla",
    "destino_id": "regla.report_evidence_and_boundaries.v1",
    "tipo_relacion": "aplica",
    "cardinalidad": "N:M",
    "requerido": true,
    "orden": null
  }
}
