{
  "id": "artefacto.review_result.v1",
  "entity_family": "artefacto",
  "contract_kind": "entity",
  "version": {
    "major": 1
  },
  "status": "draft",
  "schema_ref": null,
  "descripcion": null,
  "source_refs": [],
  "payload": {
    "tipo": "response_component",
    "nombre": "review_result",
    "referencia": null
  }
}
