{
  "id": "relacion.workflow.release_deployment.compone.workflow_step.evidence_review.v1",
  "entity_family": "relacion",
  "contract_kind": "relationship",
  "version": {
    "major": 1
  },
  "status": "draft",
  "schema_ref": null,
  "descripcion": null,
  "source_refs": [],
  "payload": {
    "origen_entidad": "workflow",
    "origen_id": "workflow.release_deployment.v1",
    "destino_entidad": "workflow_step",
    "destino_id": "workflow_step.evidence_review.v1",
    "tipo_relacion": "compone",
    "cardinalidad": "N:M",
    "requerido": true,
    "orden": 4
  }
}
