{
  "id": "relacion.actor.browser_chat.usa.fuente.repository_file.v1",
  "entity_family": "relacion",
  "contract_kind": "relationship",
  "version": {
    "major": 1
  },
  "status": "draft",
  "schema_ref": null,
  "descripcion": null,
  "source_refs": [],
  "payload": {
    "origen_entidad": "actor",
    "origen_id": "actor.browser_chat.v1",
    "destino_entidad": "fuente",
    "destino_id": "fuente.repository_file.v1",
    "tipo_relacion": "usa",
    "cardinalidad": "N:M",
    "requerido": true,
    "orden": null
  }
}
