{
  "id": "workflow.review_readiness.v1",
  "entity_family": "workflow",
  "contract_kind": "entity",
  "version": {
    "major": 1
  },
  "status": "draft",
  "schema_ref": null,
  "descripcion": null,
  "source_refs": [],
  "payload": {
    "nombre": "review_readiness",
    "etapa_ciclo_vida": "review"
  }
}
