{
  "id": "relacion.accion.request_pm_decision.produce.artefacto.pm_decision_request.v1",
  "entity_family": "relacion",
  "contract_kind": "relationship",
  "version": {
    "major": 1
  },
  "status": "draft",
  "schema_ref": null,
  "descripcion": null,
  "source_refs": [],
  "payload": {
    "origen_entidad": "accion",
    "origen_id": "accion.request_pm_decision.v1",
    "destino_entidad": "artefacto",
    "destino_id": "artefacto.pm_decision_request.v1",
    "tipo_relacion": "produce",
    "cardinalidad": "N:M",
    "requerido": true,
    "orden": null
  }
}
