{
  "id": "relacion.rol.product_game_design.usa.plantilla.project_os_v2_response.v1",
  "entity_family": "relacion",
  "contract_kind": "relationship",
  "version": {
    "major": 1
  },
  "status": "active",
  "schema_ref": null,
  "descripcion": null,
  "source_refs": [],
  "payload": {
    "origen_entidad": "rol",
    "origen_id": "rol.product_game_design.v1",
    "destino_entidad": "plantilla",
    "destino_id": "plantilla.project_os_v2_response.v1",
    "tipo_relacion": "usa",
    "cardinalidad": "N:M",
    "requerido": true,
    "orden": null
  }
}
