{
  "id": "relacion.variable.branch.parametriza.plantilla.project_os_v2_response.v1",
  "entity_family": "relacion",
  "contract_kind": "relationship",
  "version": {
    "major": 1
  },
  "status": "draft",
  "schema_ref": null,
  "descripcion": null,
  "source_refs": [],
  "payload": {
    "origen_entidad": "variable",
    "origen_id": "variable.branch.v1",
    "destino_entidad": "plantilla",
    "destino_id": "plantilla.project_os_v2_response.v1",
    "tipo_relacion": "parametriza",
    "cardinalidad": "N:M",
    "requerido": true,
    "orden": null
  }
}
