{
  "id": "contrato.formaliza.actor.v1",
  "entity_family": "contrato",
  "contract_kind": "entity",
  "version": {
    "major": 1
  },
  "status": "draft",
  "schema_ref": null,
  "descripcion": null,
  "source_refs": [],
  "payload": {
    "nombre": "contrato_formaliza_actor",
    "entidad_tipo": "actor"
  }
}
