{
  "id": "relacion.resolver.project_os_v2_contract_resolver.carga.contrato.formaliza_plantilla.v1",
  "entity_family": "relacion",
  "contract_kind": "relationship",
  "version": {
    "major": 1
  },
  "status": "draft",
  "schema_ref": null,
  "descripcion": null,
  "source_refs": [],
  "payload": {
    "origen_entidad": "resolver",
    "origen_id": "resolver.project_os_v2_contract_resolver.v1",
    "destino_entidad": "contrato",
    "destino_id": "contrato.formaliza.plantilla.v1",
    "tipo_relacion": "carga",
    "cardinalidad": "1:N",
    "requerido": true,
    "orden": null
  }
}
