{
  "id": "relacion.plantilla.project_os_v2_response.genera.artefacto.feedback_packet.v1",
  "entity_family": "relacion",
  "contract_kind": "relationship",
  "version": {
    "major": 1
  },
  "status": "draft",
  "schema_ref": null,
  "descripcion": null,
  "source_refs": [],
  "payload": {
    "origen_entidad": "plantilla",
    "origen_id": "plantilla.project_os_v2_response.v1",
    "destino_entidad": "artefacto",
    "destino_id": "artefacto.feedback_packet.v1",
    "tipo_relacion": "genera",
    "cardinalidad": "1:N",
    "requerido": true,
    "orden": null
  }
}
