{
  "id": "variable.branch.v1",
  "entity_family": "variable",
  "contract_kind": "entity",
  "version": {
    "major": 1
  },
  "status": "draft",
  "schema_ref": null,
  "descripcion": null,
  "source_refs": [],
  "payload": {
    "nombre": "branch",
    "tipo": "string",
    "valor_default": null,
    "valores_permitidos": []
  }
}
