{
  "id": "relacion.rol.creative_content_production.aplica.regla.preserve_entity_relationship_normalization.v1",
  "entity_family": "relacion",
  "contract_kind": "relationship",
  "version": {
    "major": 1
  },
  "status": "draft",
  "schema_ref": null,
  "descripcion": null,
  "source_refs": [],
  "payload": {
    "origen_entidad": "rol",
    "origen_id": "rol.creative_content_production.v1",
    "destino_entidad": "regla",
    "destino_id": "regla.preserve_entity_relationship_normalization.v1",
    "tipo_relacion": "aplica",
    "cardinalidad": "N:M",
    "requerido": true,
    "orden": null
  }
}
