{
  "id": "relacion.rol.gtm_community_operations.aplica.regla.maintain_role_lens_without_authority_expansion.v1",
  "entity_family": "relacion",
  "contract_kind": "relationship",
  "version": {
    "major": 1
  },
  "status": "active",
  "schema_ref": null,
  "descripcion": null,
  "source_refs": [],
  "payload": {
    "origen_entidad": "rol",
    "origen_id": "rol.gtm_community_operations.v1",
    "destino_entidad": "regla",
    "destino_id": "regla.maintain_role_lens_without_authority_expansion.v1",
    "tipo_relacion": "aplica",
    "cardinalidad": "N:M",
    "requerido": true,
    "orden": null
  }
}
